{
  "OrderId": 500123,
  "OrderCurrency": "EUR",
  "PayoutId": 500123,
  "OrderDate": "2026-06-02T12:00:00Z",
  "OrderType": "Cash",
  "RefundDate": "2026-06-02T12:00:00Z",
  "StoreId": 500123,
  "TotalRefund": 12.5,
  "RefundedFees": 12.5,
  "RefundedAmount": 12.5,
  "CashFeeRefundedToCustomer": 12.5
}